isbn13,title
9780764544576,John Deere Farm Tractors: A History of the John Deere Tractor
9780141184272,Corvette: Fifty Years
9780156027786,Tough to Tackle
9780156030410,Complete Guide to OneNote
9780156028066,The Goon Show  Volume 4: My Knees Have Fallen Off!
9780156319522,The Goon Show: Moriarty Where Are You?
9780375701368,The Goon Show  Volume 11: He's Fallen in the Water!
9780156508872,The Echo Maker
9781930464063,Power vs. Force
9780141185323,The Power of Art
9780156508841,Goodbye  Darkness: A Memoir of the Pacific War
9780156031639,A World Lit Only by Fire: The Medieval Mind and the Renaissance: Portrait of an Age
9780152045739,The Last Lion 2: Winston Spencer Churchill: Alone  1932-40
9780689863110,The Glory and the Dream: A Narrative History of America 1932-72
9780689848827,The Last Lion: Winston Spencer Churchill: Visions of Glory  1874-1932
9780810980631,The Last Lion: Winston Spencer Churchill: Visions of Glory 1874-1932
9780334028963,Moon-Flash (Kyreol  #1-2)
9781585677283,Harrowing the Dragon
9780345456328,Cygnet (Cygnet  #1-2)
9780345456311,Solstice Wood (Winter Rose  #2)
9780446613323,Od Magic
9780345483867,25 Ways to Win with People: How to Make Others Feel Like a Million Bucks
9780345483874,Winning with People Workbook
9780345422552,Thornhold (The Harpers  #16; Songs & Swords  #4)
9781556908682,The Best of the Realms: The Stories of Elaine Cunningham (Forgotten Realms: The Best of the Realms  #3)
9780451454249,Changeling Storytellers Guide
9780738706122,The Blood Wood (Earthdawn 6113)
9780060766740,Basin and Range
9780262240512,The Deltoid Pumpkin Seed
9780262740159,Assembling California
9780262740258,Master of Swords (Mageverse #4)
9780745622088,Master of the Night (Mageverse #1)
9780745628974,Master of Wolves (Mageverse  #3)
9780156572040,Captive Dreams
9780156932509,Master of Dragons (Mageverse #5)
9781580628365,Master of the Moon (Mageverse #2)
9780380815937,Jane's Warlord (Warlord #1)
9780140367058,Over The Moon (Mageverse #3.5)
9780060987527,Mr. and Mistress (Dynasties: The Elliotts #5)
9780470008294,Artesia Volume 1
9781857988192,Law of Enclosures
9780805080759,The Drift House: The First Voyage
9780767900317,Through a Brazen Mirror
9780195144819,The Porcelain Dove
9781886350854,Interfictions: An Anthology of Interstitial Writing
9780395680926,The Fall of the Kings (Riverside  #3)
9780395710418,Killing Time
9780261102422,The Tangled Thread (Morland Dynasty  #10)
9781593600259,The Flood-Tide (Morland Dynasty  #9)
9780048231536,The White Road (Morland Dynasty  #28)
9781880656419,The Maiden (The Morland Dynasty  #8)
9780822003908,The Oak Apple (Morland Dynasty  #4)
9780743457910,The Emperor (The Morland Dynasty  #11)
9780330426947,The Nature of the Child
9780140564303,Confessions of a Pagan Nun
9780439672320,Westminster Abby
9780439343909,Changelings
9780738709123,Dragon's Fire (Pern  #19)
9781400078127,Maelstrom
9780375836671,The Mark of the Crown (Star Wars: Jedi Apprentice  #4)
9780439389501,The Sea
9780375831003,Joy Within
9780439241878,Butch/Femme
9783473352340,Expository Writing: Mini-Lessons * Strategies * Activities
9780023895302,Persuasive Writing: Mini-Lessons  Strategies  Activities
9780140449495,McDougal Littell Science: Student Edition Grade 6 Earth Science 2006
9780911589030,Daisy Bates: Civil Rights Crusader from Arkansas
9780140449129,The Loftier Way: Tales from the Ancient American Frontier
9780393979176,A Higher Justice (The Trials of Kit Shannon #5)
9781400132744,Plot & Structure: Techniques and Exercises for Crafting a Plot That Grips Readers from Start to Finish
9780691099507,Deadlock
9780486414249,Breach of Promise
9781586638221,Keats's Poetry and Prose
9780521484008,A False Mirror (Inspector Ian Rutledge  #9)
9781593080235,Wings of Fire (Inspector Ian Rutledge  #2)
9780141804514,A Cold Treachery (Inspector Ian Rutledge  #7)
9781591940487,The Murder Stone
,Legacy of the Dead (Inspector Ian Rutledge  #4)
9780226300689,A Fearsome Doubt (Inspector Ian Rutledge  #6)
,Watchers of Time (Inspector Ian Rutledge  #5)
9780688104641,Search the Dark (Inspector Ian Rutledge  #3)
9781400043194,Bill Bryson's African Diary
9780451529695,Hunters of Dune (Dune Chronicles  #7)
9780373632442,The Battle Of Corrin (Legends of Dune  #3)
9781892065148,House Corrino (Prelude to Dune #3)
9781550373967,House Harkonnen (Prelude to Dune #2)
9781591165996,Doctor Who: The Inside Story
9780787976385,Doctor Who Short Trips: Repercussions
9780226467719,Gerontius
9780743536950,Hellstrom's Hive
,The Dark City (Eliot Ness  #1)
9780451098276,Bullet Proof (Eliot Ness  #3)
9781587671098,The Penguin Companion to European Literature
9780140444414,West To Eden
9780140440065,The Various
9780142437223,Truman Capote: In Which Various Friends  Enemies  Acquaintances  and Detractors Recall His Turbulent Career
9780471158479,The Burnt Orange Heresy
9780553213393,Ewan McGregor: From Junkie to Jedi
,Shadow Twin
9780812034110,The Complete Stories of Robert Louis Stevenson: Strange Case of Dr. Jekyll and Mr. Hyde and Nineteen Other Tales
9780142437544,The Complete Short Stories Of Robert Louis Stevenson: With A Selection Of The Best Short Novels
9780553213447,A Child's Garden of Verses
9780140444438,Have Space Suit—Will Travel
9780140444421,Practicalities
9780253201621,India Song
9780486272665,Clown
9780451527400,The Spiral Stair (Arabel and Mortimer  #6)
9781400096220,A Near Thing for Captain Najork (Captain Najork #2)
9780440905608,Cover Her Face (Adam Dalgliesh #1)
9780763632069,Reptiles and Amphibians (Smithsonian Handbooks)
9780674002050,The Camera (Ansel Adams Photography  #1)
9780374525118,The Negative (Ansel Adams Photography  #2)
9780571143726,The Print (Ansel Adams Photography  #3)
9780571210916,The Changing Status of the Artist
9780916724948,Vicars of Christ: A History of the Popes
9780571207985,The Big Bing: Black Holes of Time Management  Gaseous Executive Bodies  Exploding Careers  and Other Theories on the Origins of the Business Universe
,What Would Machiavelli Do?: The Ends Justify the Meanness
,William James: In the Maelstrom of American Modernism
9781857150940,Cliffs Notes on Wright's Black Boy
9780393962932,The Wit and Wisdom of Abraham Lincoln: A Book of Quotations
9780684839790,Speeches and Writings 1832–1858
9780688094553,Selected Speeches and Writings
9780552146784,George Eliot: The Last Victorian
9780142402498,The Mill on the Floss
9780670557110,Scenes of Clerical Life
9780140309591,Terry Jones' Medieval Lives
9780140326093,Terry Jones' Fairy Tales
9781930900240,Some Ether
9780140503449,Tin House: Evil (Volume 8 no. 3)
9780140317206,A Note Slipped Under the Door: Teaching from Poems We Love
9781883937669,The Trouble with Testosterone and Other Essays on the Biology of the Human Predicament
,Monkeyluv: And Other Essays on Our Lives as Animals
9780698115910,Literary Criticism  Vol. 1: Essays on Literature / American Writers / English Writers
9780689846731,Advanced Statistics Demystified
9780723247708,Lilly's Big Day
9780723257042,Chester's Way
9780723249863,Julius  the Baby of the World
9780723258735,Forms of Talk
9780723258056,Interaction Ritual - Essays on Face-to-Face Behavior
9780723257639,Study Bible: NIV
9780312369347,My Lord Eternity (Immortal Rogues  #2)
9780723247791,Aesop's Fables
9781402713187,Once A Wolf: How Wildlife Biologists Fought to Bring Back the Gray Wolf
9780848805012,Conversations with Don DeLillo
9780141026282,Inventing America: Jefferson's Declaration of Independence
9780804717113,Lincoln at Gettysburg: The Words That Remade America
9780865165465,Venice: Lion City: The Religion of Empire
9780226323985,Four Weddings and a Funeral
9780393956535,Halloween
9781402726002,Janet  My Mother and Me: A Memoir of Growing Up with Janet Flanner and Natalia Danesi Murray
9780141439648,Catch That Pass!
9780764587276,Divide and Conquer (Tom Clancy's Op-Center  #7)
9780940450363,Death Match (Tom Clancy's Net Force Explorers  #18)
9780299125400,Line of Control (Tom Clancy's Op-Center  #8)
,Sea of Fire (Tom Clancy's Op-Center  #10)
9780192807267,One is the Loneliest Number (Tom Clancy's Net Force Explorers  #3)
9780822002833,Aliens: Nightmare Asylum
9780812972016,The Omega Cage (Matador  #4)
,The 97th Step (Matador  #5)
9780140442571,A Friar's Bloodfeud (Knights Templar  #20)
9781578633227,Death Ship of Dartmouth (Knights Templar  #21)
9780321427137,The John Deere Two-Cylinder Tractor Encyclopedia: The Complete Model-by-Model History
9780007158058,Phantoms
9780192833761,Fantasy Gone Wrong
9781586170264,The Ghosts in Baker Street: New Tales of Sherlock Holmes
9780375758119,Christmas Bestiary
9780345478849,Black Cats and Broken Mirrors
9780753818817,Time Twisters
9781857151923,The Western Canon: The Books and School of the Ages
9780143036241,Shakespeare: The Invention of the Human
9780140150605,The American Religion
9780451159410,American Caesar: Douglas MacArthur 1880-1964
9780743260220,Winchester Shotguns
9780330397810,Colossians and Philemon: A Critical and Exegetical Commentary (International Critical Commentary)
9780439650373,Maurice Sendak's Seven Little Monsters: What Time is It? - Book #4
9780590444774,Meditations for Manifesting: Morning and Evening Meditations to Literally Create Your Heart's Desire
9780590849029,There's a Spiritual Solution to Every Problem
9780439650366,Michael Smith Elements of Style
9780590434119,Spares
9780590440615,One of Us
9780590189828,The Secret City (Pyrates  #1)
9780763628284,The Theory and Practice of Group Psychotherapy
9780312342340,When Nietzsche Wept
9781590300732,Existential Psychotherapy
9780064472777,Crown of Stars (Crown of Stars  #7)
9780060724504,Crown Duel (Crown & Court #1-2)
9780786282821,A Rose for the Crown
9780373792733,The Bloody Crown of Conan (Conan the Cimmerian  #2)
9780385323284,Rough Crossings: Britain  the Slaves and the American Revolution
9780440237679,Landscape and Memory
9780786851966,The Embarrassment of Riches: An Interpretation of Dutch Culture in the Golden Age
9780786809967,Citizens: A Chronicle of the French Revolution
9780312424688,The Feelings Book: The Care & Keeping of Your Emotions
9780312422325,A Smart Girl's Guide to Money: How to Make It  Save It  And Spend It
9780571212187,What Would You Do? (American Girl Library)
9780571226337,The Halloween Activity Book: Creepy  Crawly  Hairy  Scary Things to Do
9780141187563,The Capricorn Stone
9780285620643,Golden Urchin
9780143038412,The Ethics of Ambiguity
9781415926697,She Came to Stay
9780486217611,The Coming of Age
9780060938109,A Transatlantic Love Affair: Letters to Nelson Algren
9780140442274,What Life Was Like When Rome Ruled the World: The Roman Empire  100 BC - AD 200 (What Life Was Like)
9780486440118,Sudden Fiction International: 60 Short-Short Stories
9780192802590,Sudden Fiction: American Short-Short Stories
9780007203949,Sarah Bernhardt
,The Art of Controversy (The Essays of Arthur Schopenhauer)
,The Wisdom of Life
9780553378498,For All Time (Time Travelers  #4)
9780060254926,Wanted!
9780394584041,The Time Travelers: Volume One
9780684825007,The Stranger
9780912050263,Every Night Italian: Every Night Italian
9780374525071,More Classic Italian Cooking
9780156709903,Practice Makes Perfect: Italian Verb Tenses
9780449149911,Effigies (Faye Longchamp  #3)
9780425188224,The Cambridge Companion to Schopenhauer
9780671685638,Stormie: A Story of Forgiveness and Healing
,The Orion Mystery: Unlocking the Secrets of the Pyramids
9780425189641,Orion (Orion  #1)
9781594481925,Lake Orion (Images of America: Michigan)
9780812971422,Rick Steves' Europe Through the Back Door
9780811850995,A Dangerous Man (Hank Thompson  #3)
9780345450395,Already Dead (Joe Pitt  #1)
9780743235013,Caught Stealing (Hank Thompson  #1)
9780679732341,Ultimate Annuals  Volume 2
9780783554563,Dead I Well May Be (Dead Trilogy #1)
9780783554518,The Dead Yard (Michael Forsythe #2)
9780809493784,The Lighthouse Land (Lighthouse Trilogy #1)
9780783554617,Spider Mountain (Cam Richter  #2)
9780783554556,The Edge of Honor
9780783554570,The Firefly
9780783554594,Diary of a Spider
34406054602,The Snow Spider (Snow Spider Trilogy  #1)
9780312241223,Ultimate Spider-Man  Volume 16: Deadpool
9780571145348,Ultimate Spider-Man  Volume 7
9781400033829,Fables: 1001 Nights of Snowfall
9780375703423,Cold Fire / Hideaway / The Key to Midnight
9780571218851,Fables  Vol. 8: Wolves
9780425143322,Fables  Vol. 4: March of the Wooden Soldiers
,Fables  Vol. 1: Legends in Exile
9780425147580,Fables  Vol. 7: Arabian Nights (and Days)
9780425204245,Fables  Vol. 6: Homelands
9780425171394,Fables  Vol. 3: Storybook Love
9780425154540,Fables  Vol. 5: The Mean Seasons
9780141004921,The Choice: A Fable of Free Trade and Protectionism
9780006479758,Brewer's Dictionary of Phrase and Fable
9780425188132,Jack of Fables  Vol. 1: The (Nearly) Great Escape
9780425207369,Math Fables
9780425199114,The Five Dysfunctions of a Team: A Leadership Fable
9780425166826,Aesop's Fables
9780425183038,Icebound
9780425182673,Odd Thomas (Odd Thomas #1)
9780425161739,Seize the Night (Moonlight Bay  #2)
9780425187050,From the Corner of His Eye
9780425186701,The Good Guy
9780425180969,Pompeii
9780425176931,3rd Degree
9780425157701,2nd Chance (Women's Murder Club #2)
9780399148705,The Big Bad Wolf
9780879387556,Pop Goes the Weasel
9780760320068,The Winds of War (The Henry Family  #1)
9780316140584,Hollywood Station (Hollywood Station  #1)
9781590592168,The Choirboys
9780563388692,Fire Lover: A True Story
9780563388548,Floaters
9780563388326,The New Centurions
,The Black Marble
9780374146351,The Secrets of Harry Bright
9781561709335,Lines and Shadows
9780061176104,Hollywood Tough (Shane Scully  #3)
9780316501118,Cold Hit (Shane Scully #5)
9780316545563,Trunk Music (Harry Bosch  #5; Harry Bosch Universe  #6)
9780316545129,Angels Flight (Harry Bosch  #6)
9780553345896,The Black Echo (Harry Bosch  #1; Harry Bosch Universe  #1)
9780316545037,The Closers (Harry Bosch  #11; Harry Bosch Universe  #14)
9780385313483,Echo Park (Harry Bosch  #12; Harry Bosch Universe  #16)
9780142403013,The Poet (Jack McEvoy  #1; Harry Bosch Universe  #5)
9780441014439,The Concrete Blonde (Harry Bosch  #3)
9780441014835,The Best American Mystery Stories 2003
9780441014651,Hundred-Dollar Baby (Spenser  #34)
9780441013340,The Spenser Collection: Volume I (Spenser  #27-28)
9780785260943,School Days (Spenser  #33)
9780785260905,Potshot (Spenser  #28)
9780786918089,Chance (Spenser  #23)
9780786942886,The Accidental Time Machine
9781565047082,A Separate War and Other Stories
9781555603137,The Forever War (The Forever War  #1)
9780374516901,Worlds Enough and Time (Worlds #3)
9780374516352,The Coming
9780374523930,Forever Peace (The Forever War  #2)
,Dealing in Futures
9780425209219,Study War No More: A Selection of Alternatives
9780425198803,Not of Woman Born
9780425207437,Worlds Apart (Worlds 2)
9780425207758,Train_man  Volume 3 (Train_man)
9780425214244,The Best American Mystery Stories 2004
9780425203576,Mystic River
9780425196847,Mystic River
9780425213438,Coronado: Stories
9780373767236,Prayers for Rain (Kenzie & Gennaro  #5)
9781932386226,A Drink Before the War (Kenzie & Gennaro  #1)
9780671003470,Shutter Island
9781599900056,The Best American Mystery Stories 2002
9781885865243,The Black Dahlia (L.A. Quartet  #1)
9780452272262,The Black Dahlia Files: The Mob  the Mogul  and the Murder That Transfixed Los Angeles
9781931520249,Corroborating Evidence: The Black Dahlia Murder
9780553585940,Childhood Shadows: The Hidden Story of the Black Dahlia Murder
9780380732029,Triptych (Will Trent  #1)
9780751506471,Blindsighted (Grant County  #1)
9780751506464,Kisscut (Grant County  #2)
9780751533453,Beyond Reach (Grant County  #6)
9780751506457,A Faint Cold Fear (Grant County  #3)
9780751506419,Faithless (Grant County  #5)
9780751506488,Like A Charm
9780465048526,Like a Charm
9781570629136,The Enemy (Jack Reacher  #8)
9780142404133,The Visitor (Jack Reacher  #4)
9780345470034,Tripwire (Jack Reacher  #3)
9780345480286,Killing Floor (Jack Reacher  #1)
9780345470041,Without Fail (Jack Reacher  #6)
9780590519342,The Enemy (Jack Reacher  #8)
9780739333778,One Shot (Jack Reacher  #9)
9780671763794,Bad Luck and Trouble (Jack Reacher  #11)
9780517702222,The Enemy (Jack Reacher  #8)
9780590103879,The Visitor (Jack Reacher  #4)
9780590209342,Echo Burning (Jack Reacher  #5)
9780618615384,Tripwire (Jack Reacher  #3)
9781578068012,The Enemy (Jack Reacher  #8)
9780877477853,Tripwire (Jack Reacher  #3)
9780764226465,Tripwire (Jack Reacher  #3)
9781582972947,The Enemy (Jack Reacher  #8)
9780310243885,Blood on the Moon: The Assassination of Abraham Lincoln
9780310243878,The Blood of the Moon: Understanding the Historic Struggle Between Islam and Western Civilization
9780393924916,Blood on the Moon (Lloyd Hopkins  #1)
9780060786731,Blood Moon Over Bengal
9780312965686,Blood Moon Over Britain
9780553586619,The Silent Gondoliers
9780553586602,The Season: A Candid Look at Broadway
9780553583151,Heat
9780553583175,Tinsel
9780553583168,William Goldman: Four Screenplays
9780312971281,The Princess Bride
9780385605144,Hype and Glory
9780765312921,Boys and Girls Together
9780340823378,Wait Till Next Year: The Story of a Season When What Should've Happened Didn't  and What Could've Gone Wrong Did
9780553580334,The Princess Bride: S. Morgenstern's Classic Tale of True Love and High Adventure
9780553580303,Creepers
9780563486497,The Totem
9781844350483,The League of Night and Fog (Mortalis  #3)
9781862074934,Scavenger (Frank Balenger  #2)
9780553144383,The Fraternity of the Stone (Mortalis  #2)
9780727862426,The Brotherhood of the Rose (Mortalis  #1)
9780727862983,The Protector (Cavanaugh #1)
9780140510355,Assumed Identity
9780380706013,The Last Kingdom (The Saxon Stories  #1)
9780440420293,The Last Kingdom (The Saxon Stories  #1)
9780385491730,The Last Kingdom (The Saxon Stories  #1)
9780786706686,Time To Hunt (Bob Lee Swagger  #3)
9780859652766,Black Light (Bob Lee Swagger  #2)
9781596060296,The Day Before Midnight
,Hot Springs (Earl Swagger  #1)
,Point Of Impact (Bob Lee Swagger  #1)
9780375761355,Dirty White Boys
9780306808821,The Book of the Dead  (Pendergast  #7; Diogenes  #3)
9780689823824,Relic (Pendergast #1)
9781416505495,The Wheel of Darkness (Pendergast  #8)
9780802133113,Tyrannosaur Canyon
,Waterworks
9780802131355,The Devil in the White City: Murder  Magic  and Madness at the Fair That Changed America
9780805059335,King Icahn
9781903015070,The Sicilian
9781567923230,The Dark Arena
9780563528272,Omerta
9780789493934,Fools Die
9780821221846,The Godfather
9780821221860,The Fortunate Pilgrim
9780821221877,On the Road to Perdition — Oasis  Sanctuary  and Detour — (Road to Perdition  #2)
9780300077421,Oasis (On the Road to Perdition  #1)
9780806523705,Double Dealer (CSI: Crime Scene Investigation  #1)
9780060529574,The London Blitz Murders (Disaster Series  #5)
9780066620107,The Last Quarry (Quarry #7)
9780618433254,Snake Eyes (CSI: Crime Scene Investigation  #8)
9780822002420,A Killing in Comics (Jack & Maggie Starr  #1)
9780486440972,The War of the Worlds Murder (Disaster Series  #6)
9780940450431,From a Buick 8
9780679737315,The Michael Crichton Collection: Jurassic Park / The Lost World / The Andromeda Strain
9780815411215,Jurassic Park
9780141439624,Binary
9780192837806,The Voices of Morebath: Reformation and Rebellion in an English Village
9780563522751,Imperial Life in the Emerald City: Inside Iraq's Green Zone
9780140322620,The Coming Economic Collapse: How You Can Thrive When Oil Costs $200 a Barrel
9781555973032,Betrayal of Trust: The Collapse of Global Public Health
9780977698943,Crash Proof: How to Profit from the Coming Economic Collapse
9781571103208,The World  the Text  and the Critic
9780684838915,Culture and Imperialism
9780743260169,Prioritizing Web Usability
9780940450226,Homepage Usability: 50 Websites Deconstructed
9780071432429,Let My People Go Surfing: The Education of a Reluctant Businessman
9780060742362,And Then There Were None
9780688154721,The Wild Trees: A Story of Passion and Daring
9780688143886,The Boat of Dreams: A Christmas Story
9780812211122,Strange Pilgrims
9780394706313,Would I Lie to You (Gossip Girl  #10)
9780310929550,Gossip Girl (Gossip Girl  #1)
9780821775509,All I Want is Everything (Gossip Girl  #3)
9780590438808,You're the One That I Want (Gossip Girl  #6)
9780618111206,The Zero
9781578067046,Zero: The Biography of a Dangerous Idea
9780618257768,Zero Debt: The Ultimate Guide to Financial Freedom
9780743299633,The Hunt for Zero Point: Inside the Classified World of Antigravity Technology
9780671047641,Year Zero
9780312143404,Count Zero (Sprawl  #2)
9780553262964,Triple Zero  (Star Wars: Republic Commando  #2)
9780684809663,Bravo Two Zero
9780316139243,This Lullaby
9780425174807,Lullabies for Little Criminals
9780425184486,Hush! A Thai Lullaby
9780425180051,Lullaby Town (Elvis Cole  #3)
9780425190913,The Iliad (SparkNotes Literature Guides)
9780425164174,The Iliad
9780553561586,The Princess Bride (Long  Tall Texans  #15)
9780441623822,The Sultan's Bought Bride  (Princess Brides  #1)
9780441581054,The Sheik & the Princess Bride (Desert Rogues  #8)
9780755323005,The Prince Kidnaps a Bride (Lost Princesses  #3)
9780755323012,Stargirl (Stargirl  #1)
9780760329634,Love  Stargirl (Stargirl  #2)
9780886773489,Stargirl LitPlans on CD
9780756403805,Son of the Mob (Son of the Mob  #1)
9780786714001,Hollywood Hustle (Son of the Mob  #2)
9780886775285,For the Sins of My Father: A Mafia Killer  His Son  and the Legacy of a Mob Life
9780886777883,Neptune Noir: Unauthorized Investigations into Veronica Mars
9780756404055,The Soloist
9781573225144,Kenang-Kenangan Seorang Geisha (Memoirs of a Geisha)
9781573227513,Memoirs of a Geisha
9780978721008,Survivor
9780316544986,Diary
9780785821083,Rant
9780567044716,Clown Girl
9780786817788,Choke
9781561703159,Haunted
9780060192303,Fugitives and Refugees: A Walk in Portland  Oregon
9780847827626,Haunted
9780006512677,Nonfiction
9780553580693,Haunted
9780439368513,Life After God
9780465092840,City of Glass: Douglas Coupland's Vancouver
9780060748128,Terry: Terry Fox and His Marathon of Hope
9780465021475,All Families Are Psychotic
9780756404062,Shampoo Planet
9780142301517,All Tomorrow's Parties (Bridge  #3)
9780743276870,Spook Country (Blue Ant  #2)
9780345461520,Burning Chrome (Sprawl  #0)
9780060539160,Idoru (Bridge #2)
9780679735120,Virtual Light (Bridge  #1)
9780679781240,Stable Strategies and Others
9780141017273,Cyberpunk and Cyberculture: Science Fiction and the Work of William Gibson
9781584855286,The Neil Gaiman Audio Collection
9781593691035,The Day I Swapped My Dad for Two Goldfish
9781584858744,Death: The Time of Your Life (Death of the Endless  #2)
9780811832793,Creatures of the Night
9780449201497,New X-Men  Volume 4: Riot at Xavier's
9780449213896,The Invisibles  Volume 1: Say You Want a Revolution
9780806501604,The Mystery Play
9780006540809,Kid Eternity
9780393314434,New X-Men  Volume 1: E Is for Extinction
9781565845602,Seven Soldiers of Victory  Volume 1
,Doom Patrol  Vol. 1: Crawling from the Wreckage (Doom Patrol  #1)
9780783554525,The Filth
9780393306132,Doom Patrol  Vol. 5: Magic Bus
9780879052652,JLA  Vol. 1: New World Order
9780791074589,Batman: Gothic
9781419161308,JLA: Earth 2
9780486435503,New X-Men: Omnibus
9780440229315,Superfolks
9780590988490,Kill Your Boyfriend
9780553494808,Batman: Arkham Asylum - A Serious House on Serious Earth
9780590456807,Doom Patrol  Vol. 4: Musclebound
9780684800288,New X-Men  Volume 7: Here Comes Tomorrow
9780345314031,The Invisibles  Vol. 7: The Invisible Kingdom
9780071451383,The Invisibles  Vol. 3: Entropy in the U.K.
9781590583425,Invisible
9780521629249,The Invisibles  Vol. 4: Bloody Hell in America
9781565078321,The Invisibles  Vol. 6: Kissing Mister Quimper
9780517884546,Invisible Residents: The Reality of Underwater UFOs
9780812532470,The Invisibles  Vol. 5: Counting to None
9780738539560,The Invisible Heart: An Economic Romance
9781566918084,Transmetropolitan  Vol. 2: Lust for Life
9780345481337,Transmetropolitan  Vol. 3: Year of the Bastard
9780345478245,Transmetropolitan  Vol. 5: Lonely City
9780345464781,Transmetropolitan  Vol. 4: The New Scum
9780785123712,Transmetropolitan  Vol. 8: Dirge
9780743470568,Transmetropolitan  Vol. 10: One More Time
9780743499484,Transmetropolitan  Vol. 9: The Cure
9780810954809,Transmetropolitan  Vol. 7: Spider's Thrash
9780312333799,Created in Darkness by Troubled Americans: The Best of McSweeney's Humor Category
9780312953966,The Fabric of the Cosmos: Space  Time and the Texture of Reality
9780312994815,The Meaning of Relativity (Science Library)
9780060001537,The Fabric of the Cosmos: Space  Time and the Texture of Reality
9780439896757,Underground! The Disinformation Guide to Ancient Civilizations  Astonishing Archaeology and Hidden History
9780785119272,Under the Influence: The Disinformation Guide to Drugs
9780785121480,You are Being Lied To: The Disinformation Guide to Media Distortion  Historical Whitewashes  and Cultural Myths
9781401203672,The Origin of Species
9780399146268,Red Herrings and White Elephants: The Origins of the Phrases We Use Every Day
9781401210014,The Origin of Species
9781401202224,The Origin of Species
9781563899423,The Origin of Satan: How Christians Demonized Jews  Pagans and Heretics
9781401210007,Discourse on the Origin of Inequality
9781401205003,On the Origins of War and the Preservation of Peace
9781401202569,The Origins of Totalitarianism
9781401204860,The Origin of Consciousness in the Breakdown of the Bicameral Mind
9780131433540,Final Fantasy Origins - Official Strategy Guide
9780061121203,Social Origins of Dictatorship and Democracy: Lord and Peasant in the Making of the Modern World
9781401212223,Smithsonian Intimate Guide to Human Origins
9780439454001,Economic Origins of Dictatorship and Democracy
9780787960759,"African Origins of the Major ""Western Religions"""
9780192840509,The Origins of the Civil Rights Movements: Black Communities Organizing for Change
