isbn13,title
9780345434814,The Arctic Event (Covert-One  #7)
9780719071157,The Altman Code (Covert-One  #4)
9780465015221,The Matlock Paper
9780679740582,Fat Pig
9780679765844,Hickory Dickory Dock (Hercule Poirot  #32)
9780060976095,A Caribbean Mystery (Miss Marple  #10)
9780099427865,Five Complete Miss Marple Novels: The Mirror Crack'd / A Caribbean Mystery / Nemesis / What Mrs. McGillicuddy Saw! / The Body in the Library
9780385319270,At Bertram's Hotel
9780385315289,Nemesis (Miss Marple  #12)
9780330304214,A Pocket Full of Rye: A BBC Radio 4 Full-Cast Dramatisation
9780449702024,Murder at the Vicarage (Miss Marple  #1)
9780141441122,Miss Marple Omnibus Vol. 3 (Murder at the Vicarage / Nemesis / Sleeping Murder / At Bertram's Hotel)
9780786407804,The Dance of Anger
9780141441047,Dance of the Gods (Circle Trilogy  #2)
9780972851725,Barnyard Dance
9780706425611,The Dance of Intimacy: A Woman's Guide to Courageous Acts of Change in Key Relationships
9780844631516,4:50 from Paddington / A Pocket Full of Rye (BBC Presents: Two Miss Marple Dramas)
9780517436325,Blood Canticle (The Vampire Chronicles #10)
9780553214321,The Vampire Armand (The Vampire Chronicles  #6)
9780195108965,Violin
9780674940529,Cry to Heaven
9781931082006,Lasher (Lives of the Mayfair Witches  #2)
9780752865331,Blood And Gold (The Vampire Chronicles  #8)
9780972589819,Hot Stuff (Cate Madigan #1)
9780752851808,Lovelock (Mayflower Trilogy  #1)
9780679722595,Treasure Box
9780752852614,Songmaster
9780385416276,Stone Tables
,William Faulkner: The Sound and the Fury and as I Lay Dying: Essays  Articles  Reviews
9780060923310,Hart's Hope
9780689848377,Children of the Mind (Ender's Saga  #4)
9780441203987,Maps in a Mirror: The Short Fiction of Orson Scott Card
9780778320890,How to Write Science Fiction & Fantasy
9781905850587,What Came Before He Shot Her (Inspector Lynley  #14)
9780226500669,With No One as Witness (Inspector Lynley  #13)
9780226500621,Deception on His Mind (Inspector Lynley  #9)
9780807085738,Becoming a Woman of Beauty and Strength: Esther
9780801489785,In Pursuit of the Proper Sinner (Inspector Lynley  #10)
9780785263784,A Woman's High Calling Growth and Study Guide
9780224060875,Living with Passion and Purpose: Luke (Woman After God's Own Heart)
9781582406121,Loving God with All Your Mind
9781401359348,Ariel Sharon: A Life
9780345486585,Life Management for Busy Woman: Growth and Study Guide
9780446576987,A Wife After God's Own Heart Growth and Study Guide
9781582404875,Lover of Unreason: Assia Wevill  Sylvia Plath's Rival and Ted Hughes' Doomed Love
9781582406190,The Journals of Sylvia Plath
9781400095957,Letters Home
9781930692473,The Poetry of Sylvia Plath
9781401917173,Black Boy
9780520215108,Angry Black White Boy
9780349102504,Bad Boys In Black Tie (Watson Brothers  #3)
9780446617451,The Twits
9781563895166,Far from the Madding Crowd
9780446691406,Far From the Madding Crowd
9781565041912,Far From the Madding Crowd
9780140286373,Far from the Madding Crowd
9780679722564,Middlemarch: An Authoritative Text  Backgrounds  Reviews and Criticism
9781590170786,Slaughterhouse: The Shocking Story of Greed  Neglect  And Inhumane Treatment Inside the U.S. Meat Industry
9780895260789,A Dance At The Slaughterhouse (Matthew Scudder  #9)
9780060572341,Slaughterhouse Blues: The Meat and Poultry Industry in North America
9780060513061,Inky The Indigo Fairy (Rainbow Magic  #6)
9780060256715,Sunny The Yellow Fairy (Rainbow Magic  #3)
9780060256579,Sky The Blue Fairy (Rainbow Magic  #5)
9780060256753,Heather The Violet Fairy (Rainbow Magic  #7)
9780066236179,Ruby the Red Fairy (Rainbow Magic  #1)
9780061130472,Unweaving the Rainbow: Science  Delusion and the Appetite for Wonder
,The Rainbow Goblins
9780425205518,The Serpent and the Rainbow
9780451206121,The Rainbow
9780399154249,Standing in the Rainbow (Elmwood Springs  #2)
9780515118360,The Scarlet Pimpernel
9781597221108,Adventures of the Scarlet Pimpernel
9781597221283,Love's Enduring Promise (Love Comes Softly  #2)
9780312360269,Of Human Bondage
9780373802517,Phantoms in the Brain: Probing the Mysteries of the Human Mind
9780373802470,Mangoes & Curry Leaves: Culinary Travels Through the Great Subcontinent
9780373802449,Curry: A Tale of Cooks and Conquerors
9780425201961,50 Great Curries of India
9780373802425,Curries Without Worries
9780425208915,In Search of Duende
9780425197493,The Selected Poems of Federico García Lorca
9780425192795,Lorca & Jimenez: Selected Poems
9780425211069,Seminar on Nietzsche's Zarathustra
9780373802135,The Polar Express
9781401210618,Trip To The North Pole (The Polar Express: The Movie)
9780312339012,Blow Fly (Kay Scarpetta  #12)
9780445405561,The Gift of the Magi and Other Short Stories
9781560971160,James and the Giant Peach
9780425215289,Ten Short Stories Book & Cd Pack (Penguin Student Editions)
9780345443588,The Ultramarines Omnibus (Ultramarines #1-3)
9780425217245,Star Wars Omnibus: X-Wing Rogue Squadron  Vol. 2
9780345443601,The Soul Drinkers Omnibus (Soul Drinkers #1-3)
9780425207970,James and the Giant Peach
9780515140873,James and the Giant Peach: a Play
9780786941223,James & The Giant Peach (Disney's)
9780515136173,The Progress of Love
9781569709061,A Memoir of Jane Austen and Other Family Recollections
9781569709054,The Jane Austen Cookbook
9781569709078,The Complete Novels
9780679888093,The Cambridge Companion to Jane Austen
9780345478160,The Man Who Loved Jane Austen (The Man Who Loved Jane Austen #1)
9780425205679,Jane Austen: A Life
9780515134476,The Complete Novels of Jane Austen
9780553816327,Persuasion
9780425209066,The History of England
9780515136814,Jane and the Wandering Eye (Jane Austen Mysteries  #3)
9780515134452,Dante: Poet of the Secular World
9780312353605,Silent Running
9780515133875,The Story of a Shipwrecked Sailor
9781421505602,Nietzche and Philosophy
9781421505626,The Will to Power
9781591164494,The Story of Philosophy: The Lives and Opinions of the World's Greatest Philosophers
9780071391405,The Oxford Companion to Philosophy
9780060788384,South Park and Philosophy: You Know  I Learned Something Today
9780060788193,Superheroes and Philosophy: Truth  Justice  and the Socratic Way
9780060572976,The Simpsons and Philosophy: The D'oh! of Homer
9780060572990,Philosophy for Dummies
9780060572969,The Philosophy of Andy Warhol (From A to B and Back Again)
9780060854096,Harry Potter and Philosophy: If Aristotle Ran Hogwarts
,Philosophy of Religion: An Anthology
9780515139754,A History of Philosophy 1: Greece and Rome
,Western Philosophy: An Anthology
9780425201374,Star Wars and Philosophy: More Powerful than You Can Possibly Imagine
9780425201398,Bullshit and Philosophy
9780515139709,The Consolation of Philosophy
9780515131093,Philosophy of Mind: Classical and Contemporary Readings
9780425197547,The Undead and Philosophy: Chicken Soup for the Soulless
9780515138153,Philosophy in a Time of Terror: Dialogues with Jürgen Habermas and Jacques Derrida
,An Introduction to Political Philosophy
9780785127239,A Source Book in Indian Philosophy
9780140449143,Philosophy: The Basics
9780465069347,A Young Person's Guide To Philosophy
9780872206335,Philosophy in the Flesh: The Embodied Mind and its Challenge to Western Thought
9780060931360,Practical Philosophy
9780872207363,Discourse on Method and Meditations on First Philosophy
9780226042756,Readings in Classical Chinese Philosophy
9780140446166,Logic and Philosophy: A Modern Introduction
9780140449280,History of Political Philosophy
9781933440170,What Is Ancient Philosophy?
9781933440187,Lectures on the History of Philosophy 1: Greek Philosophy to Plato
9780060667412,Seinfeld and Philosophy
9781933440194,Introduction to the Philosophies of Research and Criticism in Education and the Social Sciences
9780192839657,Introducing Philosophy
9780440228165,The Matrix and Philosophy: Welcome to the Desert of the Real
9780440238034,A Short History of Modern Philosophy (Routledge Classics)
9780440228844,Ancient Philosophy
9780440229407,Woody Allen and Philosophy: [You Mean My Whole Fallacy Is Wrong?]
9780440237976,Three Philosophies of Life: Ecclesiastes—Life As Vanity  Job—Life As Suffering  Song of Songs—Life As Love
9780520024274,Philosophy of Religion
9781416532354,Early Greek Philosophy
9780446618670,Contemporary Political Philosophy
9780553297836,Buffy the Vampire Slayer and Philosophy: Fear and Trembling in Sunnydale
9780446600347,Philosophy: The Classics
9780553290851,The Oxford Handbook of Philosophy of Mathematics and Logic
9780778321583,Three Books of Occult Philosophy
9780553576009,Philosophy Made Simple
9780778322849,The Philosophy of Biology
9780446616836,Ten Great Works of Philosophy
9780446614160,Philosophy and the Mirror of Nature
9780778324317,The Best American Sports Writing 2003
9780446612913,Walking the Bible: A Journey by Land Through the Five Books of Moses
9780446601856,Mac OS X: Tiger Edition (The Missing Manual)
9780446604239,Astonishing X-Men  Volume 2: Dangerous
9780553576016,FINAL FANTASY X Official Strategy Guide
9781551666723,Ultimate X-Men  Vol. 14: Phoenix?
9780553571578,Astonishing X-Men  Volume 1: Gifted
9789792234794,Cross-X
9780553576054,Astonishing X-Men  Volume 3: Torn
9780553295009,X/1999  Volume 01: Prelude
9780553804089,X/1999  Volume 02: Overture
9780446612616,The Gospel According to Job
9780553567687,Avid Editing: A Guide for Beginning and Intermediate Users
9780446603102,The Complete Poems (Poetry Library)
9780446364294,Complete Short Stories  Vol 2
9781551665313,D.H. Lawrence and Italy: Twilight in Italy/Sea and Sardinia/Etruscan Places
9780446533287,The Complete Poems
9781551666013,Sons and Lovers
9780446603089,The Woman Who Rode Away and Other Stories
9780553576078,Amnesia Moon
9780553571585,Paul Revere's Ride
9780778320265,The Great Wave: Price Revolutions and the Rhythm of History
9780553562743,Growing Old in America: The Bland-Lee Lectures Delivered at Clark University
9780515068702,Nathaniel Hawthorne: The Scarlet Letter: Essays  Articles  Reviews
9780553576061,The All-True Travels and Adventures of Lidie Newton
9780517077740,The Age of Grief
9781551667935,A Year at the Races: Reflections on Horses  Humans  Love  Money  and Luck
9780749932558,Venetia
9780743289351,Lady of Quality
9781551660950,False Colours
9780385424707,Sylvester
,The Convenient Marriage
9780446616812,Sprig Muslin
9780553569698,The Talisman Ring
,The Nonesuch
9780553218367,The Foundling
,Ali and Nino
,Last Rights (Francis Hancock #1)
9780684867489,Belshazzar's Daughter (Inspector Ikmen #1)
9780140447576,Deep Waters (Cetin Ikmen  #4)
9780486424651,After the Mourning (Francis Hancock #2)
9780312157111,Spiritual Midwifery
9781931859257,Monday Night Class
9781599869957,Summer of the Dragon
9781593083755,Devil May Care
9780717802418,The Deeds of the Disturber (Amelia Peabody  #5)
9780143037514,The Mammoth Book of Egyptian Whodunnits
9780670038169,The Best American Classics
9782264022448,Cook's Illustrated 2005 (Cook's Illustrated Annuals)
9781840466720,Cook's Illustrated 2003 (Cook's Illustrated Annuals)
9780415378468,Cook's Illustrated 1995 (Cook's Illustrated Annuals)
9780060520595,Zelda's Cut
9780786169429,Thanksgiving on Thursday (Magic Tree House  #27)
9780520240780,Rurouni Kenshin  Volume 27
9780192835802,Ranma 1/2  Vol. 27 (Ranma ½ (US 2nd)  #27)
9781555974329,Sukhoi Su-27 Flanker (WarbirdTech  #42)
9781581150377,1001 Illuminated Initial Letters: 27 Full-Color Plates
9780822316411,Gold Rage (Wilderness  #27)
9780295979250,Asfixia
9780465030507,Expectant Father
9780141187396,Horse Heaven
9780929587783,White Oleander
9781566633222,The Night Remembers (Night  #1)
9780140059588,The Mephisto Club (Rizzoli & Isles  #6)
9781566633949,Vanish (Rizzoli & Isles  #5)
9781566631273,Call After Midnight & Under The Knife
9780938497158,The Sinner (Rizzoli & Isles  #3)
9780679601630,Body Double (Rizzoli & Isles  #4)
9780141184548,Life Support
9780375507151,The Family that Couldn't Sleep
9780767908207,River Out of Eden: A Darwinian View of Life
9781590175866,Dragons of Eden: Speculations on the Evolution of Human Intelligence
9780395419182,Eden: It's an Endless World  Volume 1 (Eden: It's an Endless World  #1)
9781400041985,Demonic Males: Apes and the Origins of Human Violence
9780451527882,A Mad People's History of Madness
9780345472427,A Primate's Memoir: A Neuroscientist's Unconventional Life Among the Baboons
9780786863341,Blame It on the Brain: Distinguishing Chemical Imbalances  Brain Disorders  and Disobedience
9780807066812,Blame!  Vol. 7
9780060652852,The Berenstain Bears and the Blame Game
9780898709797,Blame!  Vol. 8
9780060727635,The New Don't Blame Mother: Mending the Mother-Daughter Relationship
9780805420432,Blame It on Paris
,No Wind of Blame (Inspector Hemingway #1)
9780006280897,Uncle John's Presents Blame It on the Weather: Amazing Weather Facts
9780060761530,Who's To Blame (Sweet Valley High  #66)
9780275991166,Air Gear  Vol. 2 (Air Gear  #2)
9780786174362,Air Gear  Vol. 3 (Air Gear  #3)
9780826411327,Air Gear  Vol. 1 (Air Gear  #1)
9780826418975,Air Gear  Vol. 4 (Air Gear  #4)
9784990327507,Fire in the Minds of Men: Origins of the Revolutionary Faith
9780826477910,Mutant Message Down Under
9780872201927,Mutants & Masterminds: RPG
9780140449334,Mutants: On Genetic Variety and the Human Body
9789810549411,The New Mutants Classic  Vol. 1
9780140192469,James Dean: The Mutant King: A Biography
9781416540267,Dry
9780330250696,Yes  Your Teen Is Crazy!: Loving Your Kid Without Losing Your Mind
9780140191912,Henry IV  Part 1
9780140191929,Henry IV  Part 2
9780394718231,Henry IV  part II
9780099490685,King Henry IV  Part 2
9780385722377,I Henry IV
9780385497091,Collected Plays: Henry IV  The Man with the Flower in His Mouth  Right You Are
9780064405713,Henry IV  Parts I & II
9780963625526,Black Sunday
9781590302088,Hannibal (Hannibal Lecter  #3)
9780141183022,The Hannibal Lecter Trilogy
9780679422990,Velocity
9780140178975,Hideaway
9781400040216,Lightning
9780140446043,Icebound
9780143036296,The Servants of Twilight / Darkfall / Phantoms
9781888996289,Shadow Fires
9780374524920,The Bad Place
9781593072025,Fear Nothing (Moonlight Bay  #1)
9781593072599,The Key to Midnight
,Mr. Murder
9780618446704,Phantoms
9780887847448,The Face
9780618710317,Shattered
9781414302683,Intensity
9781414305813,The Good Guy
9780842360616,The Eyes of Darkness
9780399153891,The Door to December
9780842384117,The Servants of Twilight
9781569550342,Darkfall
9780312426118,Ghosts and Grisly Things
9780679721888,Shakespeare: The Biography
9780151012268,The Necessary Shakespeare
9780312939502,Shakespeare After All
9780975306628,Playing Shakespeare: An Actor's Guide
9780679738565,John Grisham Value Collection: A Time to Kill  The Firm  The Client
9780812474947,The Pelican Brief
9781400080373,The Harry Bosch Novels  Volume 1: The Black Echo / The Black Ice / The Concrete Blonde (Harry Bosch #1-3)
9781400098040,Echo Park (Harry Bosch  #12; Harry Bosch Universe  #16)
9781400098231,Angels Flight (Harry Bosch  #6; Harry Bosch Universe  #7)
9781400098026,The Harry Bosch Novels  Volume 2: The Last Coyote / Trunk Music / Angels Flight (Harry Bosch  #4-6)
9780325008080,The Closers (Harry Bosch  #11; Harry Bosch Universe  #14)
9781400071579,The Poet (Jack McEvoy  #1; Harry Bosch Universe  #5)
9780316926348,Chasing the Dime
9780316917339,The Black Echo (Harry Bosch  #1; Harry Bosch Universe  #1)
9780316926607,Tales From Shakespeare
9780829421224,Shakespeare's Champion (Lily Bard  #2)
9780395511688,Will in the World: How Shakespeare Became Shakespeare
9780060677015,Sonnets
9780691027494,Shakespeare's Trollop (Lily Bard  #4)
9780744004298,Shakespeare's Kitchen: Renaissance Recipes for the Contemporary Cook
9780143037484,Sonnets
9780143034605,The Art of Shakespeare's Sonnets
9780142004456,Hide (Detective D.D. Warren  #2)
9780870700163,Alone (Detective D.D. Warren  #1)
9780743471329,The Third Victim (Quincy & Rainie  #2)
9780743426916,On Becoming a Novelist
9780671041557,The Art of Fiction: Notes on Craft for Young Writers
9780743426923,October Light
9780743471237,Excellence
,Conversations with Bernard Malamud (Literary Conversations)
9780744001051,Essential Tales and Poems
,Poetry  Tales and Selected Essays
,The Complete Stories
9781595322326,The Sons
9781740599245,The Metamorphosis and Other Stories
9780810992597,The Metamorphosis And Other Stories
9781565840393,Metamorphosis (Star Trek: The Next Generation)
9781933633107,Lolita
9780151012114,Lolita: The Screenplay
9780345477149,Lolita
9780802132130,Mysteries
9780883448243,Hunger
9780060955229,Victoria
9780521558723,The Wanderer
9780809095049,Pan
9780140196092,The Last Joy
9780330412445,Guilty as Charged
9780743269834,On the Shoulders of Giants: The Great Works of Physics and Astronomy
9780307237903,Visions of Heaven and Hell
9780521406772,Books of Blood: Volumes One to Three (Books of Blood #1-3)
9780684849690,Everville (Book of the Art #2)
9780739427118,The Great and Secret Show (Book of the Art #1)
9780553299618,Abarat: Days of Magic  Nights of War
9781403356208,Imajica: The Reconciliation
9780670034802,Sacrament
9780767912242,The Inhuman Condition (Books of Blood  #4)
9780767912273,Notebook of a Return to the Native Land
9780767905206,The Return of the Native
9780141011516,The Return of the Native
9780140295948,The Stephen King Collection: Stories from Night Shift
9780767912235,Blood and Smoke
9780821778067,LT's Theory of Pets
9780767907804,Silver Bullet
,Patriot Games (Jack Ryan  #1)
9781580051880,Legends
9780140280494,Bare Bones: Conversations on Terror with Stephen King
9781400034291,Four Past Midnight
9780312181109,Gerald's Game
9780878052738,Faithful: Two Diehard Boston Red Sox Fans Chronicle the Historic 2004 Season
9780736909525,The Diary of Ellen Rimbauer: My Life at Rose Red
9781414305776,Now and on Earth
9780842361934,The Monkey
9780618471164,Desperation / The Regulators: Box Set
9780618427697,Tevye's Daughters: Collected Stories of Sholom Aleichem
9780192838056,Favorite Tales of Sholom Aleichem
9780140432671,Brown Girl  Brownstones
9781840220605,Gimpel the Fool: And Other Stories
9780449911723,At the Mountains of Madness
9780345477248,At the Mountains of Madness and Other Novels
9780449911808,At the Mountains of Madness and Other Tales of Terror
9780345485595,Mountain Madness (Wilderness  #24)
9780449911891,At the Mountains of Madness and Other Novels of Terror
9780312333751,The Aeneid
9781551521916,The Aeneid (Verse Translation)
9781400034208,The Iliad
9780753821862,War and the Iliad
9781853260216,The Iliad
9780451529794,Trojan Odyssey (Dirk Pitt  #17)
9780563504078,The Divine Comedy II: Purgatory
9780446676489,The Divine Comedy
9780446675239,Paradiso (The Divine Comedy  #3)
9780688166250,Modern Reader's Guide to Dante's the Divine Comedy
9780312989385,The Canterbury Tales
9780312990718,The Canterbury Tales: Fifteen Tales and the General Prologue
9780312990695,Fanning the Flame: Bible  Cross  and Mission
9780940450820,From the Earth to the Moon (Extraordinary Voyages  #4)
9780143037613,The Mammoth Book of New Jules Verne Adventures: Return to the Center of the Earth and Other Extraordinary Voyages  New Tales by the Heirs of Jules Verne
9780375761140,Journey to the Center of the Earth (Extraordinary Voyages  #3)
9780192806949,20 000 Leagues Under The Sea
9780141439969,The Mysterious Island (Extraordinary Voyages  #12)
9781931082099,The Lighthouse at the End of the World
9780752858494,The World of Jules Verne
9780312982515,The End of Nana Sahib: The Steam House (Extraordinary Voyages  #20)
9780553271096,Around the World in Eighty Days
9780446699075,Around the World in Eighty Days
9781593978860,The Mysterious Island
9780752858630,Adrift in the Pacific: Two Years Holiday (Extraordinary Voyages  #32)
9780571211500,Final Payments
9781572705647,Sliver of Truth (Ridley Jones #2)
9780451199928,The Mothman Prophecies
9780517035801,Intimate Communion: Awakening Your Sexual Essence
9780451199935,Letter to a Man in the Fire: Does God Exist and Does He Care?
9780451200181,The Promise of Rest
9780792737360,Perfect Match
9780451201157,Demon Box
9780006499619,Sailor Song
9780060741044,On the Bus: The Complete Guide to the Legendary Trip of Ken Kesey and the Merry Pranksters and the Birth of Counterculture
9780515141665,The Further Inquiry
9781563054426,Goodnight Moon
9780060916466,Goodnight Moon 123: A Counting Book (Over the Moon)
9780553525632,New Rules: Polite Musings from a Timid Observer
9780099460176,True Story
9780345434807,Does Anybody Have a Problem With That? The Best of Politically Incorrect
9788466302203,The Outsiders
9780345396938,Outsiders Within: Writing on Transracial Adoption
9780099471431,Outsiders  Vol. 5: The Good Fight
9780099271499,Sister Outsider: Essays and Speeches
9780312941468,Caramelo
9780312877514,The House on Mango Street
9780061093982,Selections from Homer’s Iliad
9780312876623,The Merchant of Venice
9781573456630,Nancy Drew: Girl Detective: #1-4
9780231121897,Nancy's Mysterious Letter (Nancy Drew Mystery Stories  #8)
9780425058190,The Secret of the Old Clock (Nancy Drew Mystery Stories  #1)
9780765304742,The Mystery at the Moss-covered Mansion (Nancy Drew Mystery Stories  #18)
9780765308405,The Mystery of the Brass-Bound Trunk (Nancy Drew Mystery Stories  #17)
9781582971032,The Mantle of the Prophet: Religion and Politics in Iran
9780060545628,The Greatest Generation
9780060545611,Maverick: The Success Story Behind the World's Most Unusual Workplace
9780553575095,Weekend Warriors (Sisterhood  #1)
9780736904896,The Weekend Novelist
9780553575101,The Week-End Book
9780736904940,North Carolina Weekends
9780736908160,Far from the Madding Crowd
9780736913829,Selected Poems
9781400065875,Selected Poetry
9780736910194,Underworld (Underworld  #1)
9780736911689,Underworld: The Mysterious Origins of Civilization
9780786718610,The Dream and the Underworld
9780571205219,Underworld (Star Wars: The Last of the Jedi  #3)
9780571201150,Star Wars: Underworld - The Yavin Vassilika
9780231124270,Underworld: Blood Enemy (Underworld  #2)
9780060834005,Queen of the Underworld
9781400054879,Murder in the Cathedral
9780758207746,Cathedral  Forge  and Waterwheel: Technology and Invention in the Middle Ages
9780141318301,In the Kitchen with Rosie: Oprah's Favorite Recipes
9780451528568,King Richard II
9780141439655,King Richard II
9780192801494,King Richard II
9780140620474,Floating in My Mother's Palm
9780393092103,Tearing the Silence: On Being German in America
9781591024507,Paint it Black
9780380813735,The Tempest
9780534613037,The Day of the Tempest (Dragonlance: Dragons of a New Age  #2)
9780439746854,A Tempest
9780439744669,A Midsummer Night's Dream
9780439746847,A Midsummer Night's Dream (SparkNotes Literature Guide)
9780439746861,A Midsummer Night's Dream
9780439738613,Cliffs Notes on Hugo's Les Miserables
9780618056736,Les Misérables
9780500277591,Hamlet in Purgatory
9780684839295,From Hinton to Hamlet: Building Bridges between Young Adult Literature and the Classics
9780451530301,Hamlet
9780345452887,Hamlet  Prince of Denmark
9780743487740,Romeo & Juliet
9780899664590,Romeo and Juliet
9780764228490,Romeo and Juliet
9780451530172,Shakespeare's Romeo and Juliet
9780688172176,Romeo and Juliet (SparkNotes Literature Guide)
9781579652524,Romeo and Juliet
9780195172416,South of the Border  West of the Sun
9781904920359,Clock of the Long Now: Time and Responsibility: The Ideas Behind the World's Slowest Computer
9780446670784,Jessica's Bad Idea (Sweet Valley Twins and Friends  #31)
9780811213769,How to Win Friends and Influence People
9780811200912,How to Win Friends and Influence People
9780807062135,How to Win Friends and Influence People for Teen Girls
,Naked Economics: Undressing the Dismal Science
9780691017389,The Naked Warrior: Master the Secrets of the Super-Strong - Using Bodyweight Exercises Only
9780618611690,The Naked Ape: A Zoologist's Study of the Human Animal
9780618477906,There's No Toilet Paper . . . on the Road Less Traveled: The Best of Travel Humor and Misadventure
9780425198735,Kitchen Confidential: Adventures in the Culinary Underbelly
9780486270616,More Than You Know: Finding Financial Wisdom in Unconventional Places
9780553150322,Searching for God Knows What
9780140817782,The More Than Complete Hitchhiker's Guide (Hitchhiker's Guide  #1-4 + short story)
9781844164035,Hitchhiker's Guide To The Galaxy: The Filming of the Douglas Adams classic
9781593076191,Different Seasons
9781844164165,It's Called a Breakup Because It's Broken: The Smart Girl's Break-Up Buddy
9780141311357,Jennifer Government
9780142407912,Mama Day
9780140382976,A Feather on the Breath of God
9780375724701,Mitz The Marmoset of Bloomsbury
9780192840745,War with the Newts
9780771014178,Parallel Worlds: A Journey through Creation  Higher Dimensions  and the Future of the Cosmos
9780143039501,Key Lime Pie Murder (Hannah Swensen  #9)
9780521498678,Cherry Cheesecake Murder (Hannah Swensen  #8)
9780758210371,Peach Cobbler Murder (Hannah Swensen  #7)
9780143035169,Strawberry Shortcake Murder (Hannah Swensen  #2)
9781840220551,Lemon Meringue Pie Murder (Hannah Swensen  #4)
9780141439686,Fluke: Or  I Know Why the Winged Whale Sings
9781565120556,Sugar Cookie Murder (Hannah Swensen  #6)
9780553578171,Chocolate Chip Cookie Murder (Hannah Swensen  #1)
9781590172193,Blueberry Muffin Murder (Hannah Swensen  #3)
,The Wolf Shall Dwell With the Lamb: A Spirituality for Leadership in a Multicultural Community
9780471197058,Focus: The Future of Your Company Depends on It
,Positioning: The Battle for Your Mind
9780679722052,The 22 Immutable Laws of Marketing: Violate Them at Your Own Risk
,Horse Sense: How to Pull Ahead on the Business Track
,You Suck (A Love Story  #2)
9780231138765,Bloodsucking Fiends (A Love Story  #1)
9780394704371,Island of the Sequined Love Nun
9780671739164,A Dirty Job (Grim Reaper  #1)
9780199264797,Practical Demonkeeping (Pine Cove  #1)
9781405161602,The Lust Lizard of Melancholy Cove (Pine Cove  #2)
9780812695731,Granta 7
