isbn13,title
9781573223201,Speaker for the Dead (Ender's Saga  #2)
9780252019814,The Audacity of Hope: Thoughts on Reclaiming the American Dream
9780811839747,Mao: The Unknown Story
9780375757990,The Art of War
9780691019628,Oracle Bones: A Journey Between China's Past and Present
9780486406664,Wild Swans: Three Daughters of China
9780679428954,The Wild Swans
9780198245971,Women in Love
9780691120522,Women Who Love Too Much
9780253209108,Men Who Hate Women and the Women Who Love Them: When Loving Hurts and You Don't Know Why
9780872203495,A Walk in the Woods: Rediscovering America on the Appalachian Trail
9781559343565,A Walk in the Woods: Rediscovering America on the Appalachian Trail
9780439474290,A Walk in the Woods (Stickerific)
9780807555385,The Fortress of Solitude
9780375752193,Fortress of Solitude / The Devil Genghis
9780687002825,Our Ancestors: The Cloven Viscount  The Baron in the Trees  The Non-Existent Knight
9781595542328,Difficult Loves
9780451200266,The Nonexistent Knight & The Cloven Viscount
9780393308556,The View from Castle Rock
9780768423488,The View From Castle Rock
9780802829665,Crossing to Safety
9780671737696,Oh Rats! The Story of Rats and People
9780060957261,King Rat (Asian Saga  #4)
9780349113005,Rat Bastards: The Life and Times of South Boston's Most Honorable Irish Mobster
9780345464019,Julius Knipl  Real Estate Photographer: The Beauty Supply District
,Blind Willow  Sleeping Woman: 24 Stories
9780156032292,Blind Willow  Sleeping Woman
9780141013800,The Bookseller of Kabul
9780618134304,Jasmine and Stars: Reading More Than Lolita in Tehran
9780375714573,Making Globalization Work
9780375714665,Prep : A Novel
9780375424151,Tan fuerte  tan cerca
9780375714672,The Wizard of Oz
9780753820254,The Ground Beneath Her Feet
9780786837878,The Moor's Last Sigh
9780765342409,Dangling Man
9780812565959,Grimus
9780345453860,Breakfast at Tiffany's
9780812513738,Jesus' Son
9781595550446,Angels
9780373802548,The Throne of the Third Heaven of the Nations Millennium General Assembly: Poems Collected and New
9780062507549,The Stars at Noon
9780099283577,The Rules of Attraction
9780060622138,Glamorama
9780515135961,Less Than Zero
9780099448754,A Christmas Memory
9780099448471,In Cold Blood
9780060851897,The Southern Haunting of Truman Capote
9781842430224,Summer Crossing
9781842430361,Answered Prayers
9780553107753,The Grass Harp  Including A Tree of Night and Other Stories
,From Babylon to Timbuktu: A History of the Ancient Black Races Including the Black Hebrews
,Cruelest Journey: Six Hundred Miles To Timbuktu
,Between Time and Timbuktu or Prometheus-5
9780385333474,Murder in Amsterdam: The Death of Theo van Gogh and the Limits of Tolerance
9780385333818,The Cement Garden
9780385334143,Atonement
9780385333870,Gertrud The Great Of Helfta: Spiritual Exercises
9780099267546,The Ruined Map
9780385334235,The Face of Another
9780743410588,Three Plays: Involuntary Homicide / The Green Stockings / The Ghost is Here
9780385334266,Secret Rendezvous
9780060263195,Oracle Night
9780517124369,Eleanor Rigby
9780060544881,Homo Faber
9780061131547,The Philosophy of Jean-Paul Sartre
9780553286373,Being and Nothingness
9780380977260,The Age of Reason
9780060859626,Youth in Revolt: The Journals of Nick Twisp
9781877741098,And I Don't Want to Live This Life: A Mother's Story of Her Daughter's Murder
9780553112443,Sid and Nancy: Love Kills
9780743474764,Flags of Our Fathers
9780060545840,Flags of Our Fathers: A Young People's Edition
9780060777333,A Long Way Down
9780375415036,Clockwork (Cover to Cover)
9780143036357,Mary Queen of Scots
9780156421171,Mary Queen of Scots and the Murder of Lord Darnley
9780141183725,On the Trail of Mary  Queen of Scots
9780156701761,River of Blue Fire (Otherland  #2)
9780679420255,Mary  Queen of Scots: Queen Without a Country
9781585425006,Mountain of Black Glass (Otherland  #3)
9781585425242,Mary  Queen of Scots: Pride  Passion and a Kingdom Lost
9781585424993,Queen of Scots: The True Life of Mary Stuart
9781585425495,The Last Wife of Henry VIII
9781585425549,The Children of Henry VIII
9780393324358,The Last Days of Henry VIII
9780440201045,The Autobiography of Henry VIII: With Notes by His Fool  Will Somers
9781559362153,Henry VIII (Shakespeare  Pelican)
9780374528669,The Memoirs of Cleopatra
9781400034680,Saint George and the Dragon
,Kiss Me Like a Stranger: My Search for Love and Art
9780826414755,The Complete Sherlock Holmes  Volume I
9780571224388,The Complete Sherlock Holmes  Volume II
9780385468862,The Last of Her Kind
9780765344953,Anatomy of Love: A Natural History of Mating  Marriage  and Why We Stray
9780812532579,The Devil's in the Details (A Camilla MacPhee Mystery  #4)
9780307237699,Wigfield: The Can-Do Town That Just May Not
9780679746324,The SantaLand Diaries and Season's Greetings
9780976072676,Jenny and the Jaws of Life: Short Stories
9780060826581,View With a Grain of Sand: Selected Poems
9780007176151,View with a Grain of Sand: Selected Poems
9780446608473,Poems New and Collected
9780486424583,Sounds  Feelings  Thoughts:  Seventy Poems by Wislawa Szymborska
9780099474128,Miracle Fair: Selected Poems
9780553381412,Jane Eyre
9780767902526,The Far Pavilions
9780307279460,Death in Kashmir
9780736411035,The Sun in the Morning: My Early Years in India and England
9780571219353,Death in the Andamans
9781932806496,Death in Berlin
9780330261562,The Far Pavilions
9780156260558,Enchanted Evening
9780156659758,Pathologies of Power: Health  Human Rights and the New War on the Poor
9781400042821,Infections and Inequalities: The Modern Plagues
9780771065262,Mountains Beyond Mountains: The Quest of Dr. Paul Farmer  a Man Who Would Cure the World
9780375759314,The Tao of Physics: An Exploration of the Parallels between Modern Physics and Eastern Mysticism
9780525477624,Dr. Mary's Monkey: How the Unsolved Murder of a Doctor  a Secret Laboratory in New Orleans and Cancer-Causing Monkey Viruses are Linked to Lee Harvey Oswald  the JFK Assassination and Emerging Global Epidemics
9780385333764,The Art of Richard P. Feynman
9780060837167,The Early History of God: Yahweh and the Other Deities in Ancient Israel
9780375700989,Haiti  History  and the Gods
9781400102952,Acts of God: The Unnatural History of Natural Disaster in America
9781400044610,The World's Religions
9780316159418,Introduction to World Religions
9780807831090,FDR's Folly: How Roosevelt and His New Deal Prolonged the Great Depression
9780393061222,Folly and Glory (The Berrybender Narratives  #4)
9780812972351,The Argumentative Indian: Writings on Indian History  Culture and Identity
9788426415165,Argumentative Indian: Writings On Indian History Culture And Identity
9780851703008,Things to Bring  S#!t to Do: And Other Inventories of Anxiety: My Life in Lists
9780312254995,Dumpy's Valentine
9780099592419,Mandy
,Giraffes Can't Dance
9780140189353,The Medici Giraffe and Other Tales of Exotic Animals and Power
9780812969993,The Giraffe Who Was Afraid of Heights (Physical & Behavioral Adaptation)
9780140274110,Where the Red Fern Grows with Connections
9780413772428,Summer of the Monkeys
9780099440833,Dreams from My Father: A Story of Race and Inheritance
9780060926960,Doctor Who: Cat's Cradle-Time's Crucible
9780060976101,Doctor Who: Cat's Cradle-Witch Mark
9780679781486,Doctor Who: Cat's Cradle-Warhead
9780375703843,He's Just Not That Into You: The No-Excuses Truth to Understanding Guys
9780679781493,Do Not Open This Book
9780375837890,Not Your Mother's Slow Cooker Cookbook
9780375507908,Hands Are Not for Hitting (Ages 4-7)
9781581821369,Not So Big House
9780812975932,Rodinsky's Room
9780141185934,The Rough Guide to Cuba 3
9780679745570,Cuba: A New History
9780962088117,Cuba 15
9780792274575,Cuba (Jake Grafton #7)
9780385280792,The Memory Keeper's Daughter
9781594201080,Too Far to Go: The Maples Stories
9780099468387,Far to Go (Margaret Thursday  #2)
9780099429791,The Children on the Top Floor
9780879074494,Desolation Angels
,Healing With Whole Foods: Asian Traditions and Modern Nutrition
,The New Whole Foods Encyclopedia: A Comprehensive Resource for Healthy Eating
,The Discomfort Zone: A Personal Journey
9780375726521,The Parrot's Lament  and Other True Tales of Animal Intrigue  Intelligence  and Ingenuity
9780375726538,Postscript to the Name of the Rose
9780231082815,Baby Names for Dummies
9780375726545,The Mysterious Flame of Queen Loana
9780965913225,History of Beauty
9781582346434,Baudolino
9780156421355,Travels in Hyperreality
,How to Travel with a Salmon and Other Essays
,A Theory of Semiotics
9781400076321,Art and Beauty in the Middle Ages
9780415278485,Mouse or Rat?: Translation as Negotiation
9780679738954,The Role of the Reader: Explorations in the Semiotics of Texts
,Libraries
9780385481960,The Art of War
9780449911419,Sun Tzu: The Art of War for Managers; 50 Strategic Rules
9780571145454,The Art of War
9780553384154,The Lost Continent:  Travels in Small-town America
9780440229209,Made in America: An Informal History of the English Language in the United States
9781594481932,Ulysses
9781855496958,The Long-Lost Map (Ulysses Moore #2)
9780385311298,The Wicked Wit of Charles Dickens
9780712664561,The Three Musketeers
9780946487509,The Three Musketeers
9780886778446,The Three Musketeers (Great Illustrated Classics)
9780439194044,The Three Musketeers (The d'Artagnan Romances. #1)
9780886779061,Lisey's Story
9781860645884,King Arthur Flour Whole Grain Baking: Delicious Recipes Using Nutritious Whole Grains
9780618254118,King Dork (King Dork  #1)
9780312352189,A Clash of Kings  (A Song of Ice and Fire  #2)
9780345407863,The Colorado Kid
9780060837334,Stationary Bike
9780312194390,Everything's Eventual: 14 Dark Tales
9780140714753,The Mist
9780330353823,Pet Sematary
9780316367950,The Stephen King Collection: Stories from Night Shift
9780312337070,The Man in the Black Suit: 4 Dark Tales
,The Shining
9781593080341,Stephen King: America's Best-Loved Boogeyman
9781593080402,The Illustrated Stephen King Trivia Book
9780312425944,Gray Matter and Other Stories from Night Shift
9780449908976,Thinner
9781894917124,Stephen King from A to Z: An Encyclopedia of His Life and Work
9781565117723,Black House (The Talisman  #2)
9780822216315,The Stephen King Universe: A Guide to the Worlds of the King of Horror
9780312306182,Night Shift
,Misery
9780156002165,The Bachman Books
9780571191635,Carrie
9780156011464,"Four Past Midnight: Featuring ""The Langoliers"""
9780691013800,Sam Walton: Made In America
9780393323856,The Road to Reality: A Complete Guide to the Laws of the Universe
9780142437209,The Paradox of Choice: Why More Is Less
9780517333419,Coach: Lessons on the Game of Life
9780312263102,Losers: The Road to Everyplace But the White House
9780312049997,Next: The Future Just Happened
9780312252816,The Ends of the Earth: A Journey to the Frontiers of Anarchy
9780312263089,Salvation to the Ends of the Earth: A Biblical Theology of Mission (New Studies in Biblical Theology (InterVarsity Press)  #11)
9780312151256,The Ends Of The Earth: A Journey At The Dawn Of The 21st Century
9780312265816,When Genius Failed: The Rise and Fall of Long-Term Capital Management
9780520243262,When Genius Failed: The Rise And Fall Of Long Term Capital Management
9780520229136,The Secret of Fantasy Forest (Sweet Valley Kids #67)
9780812973013,Pearl and Wagner: Three Secrets
9781570625190,A History of Britain: The Fate Of Empire 1776-2000 (A History of Britain  #3)
9780977795306,The Devil in the White City Murder  Magic and Madness at the Fair that Changed America
9782884490474,Kim
9780802839725,Birds Without Wings
9780520213685,God Knows
9780195309683,Picture This
9780062508119,Closing Time
9780800637149,Good as Gold
9781400054770,Something Happened
9780743262729,Archie Americana Series: Best of the Eighties  Vol. 1
9780312426026,The Moviegoer
9780713996876,Wicked: The Life and Times of the Wicked Witch of the West
9781584795421,The Sword and the Shield: The Mitrokhin Archive & the Secret History of the KGB
9780060885731,Lay Down My Sword And Shield (Hackberry Holland  #1)
9780061131622,Sword and Shield
9781846162664,A Year in the Merde
9780316525657,Merde!: The Real French You Were Never Taught at School
9780976882305,Merde Encore!: More of the Real French You Were Never Taught at School
9780030547744,Can't Wait to Get to Heaven
9780440415800,Green Hills of Africa
9780307383419,Across the River and into the Trees
9780426203650,Hemingway: The Paris Years
9780426203681,Adios Hemingway
9780426203674,By-Line: Selected Articles and Dispatches of Four Decades
9781416947400,The Hemingway Women: Those Who Love Him - The Wives And Others
9780439698399,Hemingway: A Biography
9781558322455,The Sword of Straw (The Sangreal Trilogy  #2)
9781575420776,A Farewell to Arms
9781561583768,A Farewell to Arms
9781862073296,The Big Rock Candy Mountain
9781843534099,Beyond the Hundredth Meridian: John Wesley Powell and the Second Opening of the West
9780300111149,Collected Stories
9780385732338,All the Little Live Things
9780312971397,Where the Bluebird Sings to the Lemonade Springs
9780143037149,Wallace Stegner: His Life and Work
9780449200162,Letters of E.B. White
9780440424949,Here Is New York
9780440412243,Charlotte's Web
9781573225052,Charlotte's Web
9781556434303,Che Guevara: A Revolutionary Life
9780140250329,Gatsby's Girl
9781598870541,In Search of Captain Zero: A Surfer's Road Trip Beyond the End of the Road
9780452280687,Pipe Dream (Strivers Row)
9780151731565,The Pleasure of My Company
,Shopgirl
9780764543401,The Mutineer: Rants  Ravings  and Missives from the Mountaintop  1977-2005
9780156030434,Generation of Swine: Tales of Shame and Degradation in the '80's
9780847826469,The Gonzo Way: A Celebration of Dr. Hunter S. Thompson
9780156029063,The Proud Highway: Saga of a Desperate Southern Gentleman  1955-1967
9780156913218,Einstein: His Life and Universe
9780156001250,The Wise Men: Six Friends and the World They Made
9780253202178,Kissinger
9780300093049,Traveling Mercies: Some Thoughts on Faith
9780753817988,Where Rainbows End
9780253203182,Irish Girls Are Back in Town
9783829601863,There's No Place Like Here
9781590302255,Final Rain (The Survivalist  #19)
9781580624596,The Pursuit of Happyness
9781402561016,Harvesting the Heart
9780552998086,The Tenth Circle
9780380713813,Mercy
9780141182803,Picture Perfect
9780439774390,Songs of the Humpback Whale
9781854790477,Salem Falls
9781593081485,The Pact
9781596009707,My Sister's Keeper
9781577658030,Cold Mountain
9781853260407,The Collected Songs of Cold Mountain
9780743289412,For One More Day
9780881507195,Just One More Day: A Memoir
9780385732918,Absolutely Mahvelous
9780553381696,The Last Innocent Man
9780843955842,Outlander (Outlander  #1)
9780743555616,A Breath of Snow and Ashes (Outlander  #6)
9781416524359,Outlander - The Exile of Sharad Hett (Star Wars: Ongoing  Volume 2)
9780671874759,The Fiery Cross (Outlander  #5)
9781416524342,Refuge (Outlanders  #36)
,Dragonfly in Amber (Outlander  #2)
9780739317365,Outlander
9780743525855,Hydra's Ring (Outlanders  #39)
9780743537001,Omega Path (Outlanders  #4)
9780836254273,Savage Sun (Outlanders  #3)
9781587671166,As I Lay Dying
9780553471830,Novels  1926-1929
,Light in August
9780451190758,Novels 1942–1954: Go Down  Moses / Intruder in the Dust / Requiem for a Nun / A Fable
9780836269147,Selected Short Stories
9780345470638,Three Famous Short Novels: Spotted Horses Old Man the Bear
9781580631600,The Town
9780451170118,Voyager (Outlander  #3)
9780450417399,Drums of Autumn (Outlander  #4)
9780452277755,The Outlandish Companion: Companion to Outlander  Dragonfly in Amber  Voyager  and Drums of Autumn
,Lord John and the Private Matter (Lord John Grey  #1)
9780671039721,Cross Stitch (Outlander  #1)
9780451185976,The Eight
,Your Eight Year Old: Lively and Outgoing
9780553562835,Eight Mindful Steps to Happiness: Walking the Buddha's Path
9780679776314,Eight Men Out: The Black Sox and the 1919 World Series
9780060005696,Eleven on Top (Stephanie Plum  #11)
9780393060911,The Portable James Joyce
9780679768098,Dubliners
9780393323528,Finnegans Wake
9780679751236,Jane Eyre
9780851115191,Jane Eyre
9780679431480,Jane Eyre
9780375758256,Purity of Blood (Adventures of Captain Alatriste  #2)
9781841155043,Barnaby Rudge
9780553483321,The Flanders Panel
9780803725744,The Seville Communion
9780786868995,Little Birds
9780385602051,The Diary of Anaïs Nin  Vol. 2: 1934-1939
,"Henry and June: From ""A Journal of Love"": The Unexpurgated Diary of Anaïs Nin  1931-1932"
9781593081928,House of Incest
9780436205491,The Diary of Anaïs Nin  Vol. 3: 1939-1944
9780684841250,The Spectator Bird
9780684868196,The Big Book of Boy Stuff
9780743239806,The Boys of Everest: Chris Bonington and the Tragedy of Climbing's Greatest Generation
9780684839745,Roald Dahl: The Storyteller (Famous Lives)
9780684841212,The Sex Lives of Cannibals: Adrift in the Equatorial Pacific
9781879794061,The Read-Aloud Handbook
9780375701962,The Working Poor: Invisible in America
9780060745905,First Comes Love (Hot Water  California #1)
,Eat Right 4 Your Type
9780465003129,The Annotated Gulliver's Travels
9780752842691,Gulliver's Travels
9781560764984,The Chronicles of Narnia CD Box Set
9781582346175,The Chronicles of Narnia (The Chronicles of Narnia  #1-7)
9780684854274,Mere Christianity
9780684854281,Mere Christianity
9781415930687,The Screwtape Letters
9780099460954,The Screwtape Letters/Book & Study Guide
9780684844640,Four Mothers
9780393318791,Four Mothers at Chautuaqua
9781841957951,The Trial of God: (as it was held on February 25  1649  in Shamgorod)
9780684839059,Summer for the Gods: The Scopes Trial and America's Continuing Debate Over Science and Religion
9780393318357,Dawn (The Night Trilogy  #2)
9780306808906,The Forgotten
9780345460806,Day (The Night Trilogy  #3)
9780743564373,All Rivers Run to the Sea
9780684174693,Father Hunger: Fathers  Daughters  and the Pursuit of Thinness
9780140139396,Father Hunger: Fathers  Daughters & Food
9780140159943,Bold Land  Bold Love (Australian Trilogy  #1)
9780143039792,Leading with a Limp: Turning Your Struggles Into Strengths
9780140154412,Something to Declare
9780375759321,How the García Girls Lost Their Accents
9780140247961,Kesey's One Flew Over the Cuckoo's Nest (Cliffs Notes)
9780060757083,One Flew Over the Cuckoo's Nest
9781892145024,One Flew over the Cuckoo's Nest
9780061228742,The Sea  The Sea
9780140364491,Existentialists and Mystics: Writings on Philosophy and Literature
9780802135582,A Fairly Honourable Defeat
9780618537259,The Unicorn
9781585421770,Bruno's Dream
9780375756603,Mystical Paths (Starbridge  #5)
9780786888016,Glittering Images (Starbridge  #1)
9780786891078,Scandalous Risks
9780684873176,Glamorous Powers (Starbridge  #2)
9780743250443,A Severed Head
9781555916220,Absolute Truths (Starbridge  #6)
9780345377968,The Shrouded Walls
9780743264730,Waiting Sands
9780684837710,The Hollow Man
9780743286978,Hardcase (Joe Kurtz  #1)
9780385496094,Summer of Night (Seasons of Horror  #1)
9780007189953,Carrion Comfort
9780743499262,The Rise of Endymion (Hyperion Cantos  #4)
9781401301880,Children of the Night
9780821726846,The Group
9780060744878,Haruki Murakami and the Music of Words
9780140230277,Norwegian Wood
9780743496711,A Wild Sheep Chase (The Rat  #3)
9780743422444,Horton Hatches the Egg
9780425185506,Seaward
9780743431019,The Boggart
9780743418713,Silver on the Tree (The Dark is Rising  #5)
9780061150142,The Long Goodbye (Philip Marlowe  #6)
9780743454537,Trouble Is My Business
9780802142849,The Captain's Verses
9781556591402,Herbert the Timid Dragon
9781401303273,Under the Net
9780099486831,Love
,Beloved
9780399512469,Song of Solomon
9780060739683,The Bluest Eye
9780440242949,100 Love Sonnets
9780385340397,Jazz
9781569715147,Jazz
9780440221661,Sula
9780373638499,Sula
9780385302319,Sula
9781844164110,Sula
9780373638529,Tar Baby
9780373638178,Pacific Northwest Hiking: The Complete Guide to More Than 1 000 of the Best Hikes in Washington and Oregon (Foghorn Outdoors)
9780373638161,The Guns of August
9780375504525,It Can't Happen Here
9781931082891,Babbitt
9780679732266,Main Street
9780940450851,Main Street
9780679424789,Arrowsmith / Elmer Gantry / Dodsworth
9780394701493,Arthur Edward Waite's Quest of the Golden Stairs
9780394701844,Arrowsmith
9780385335997,Something Wicked This Way Comes
9780385335980,Living on the Ragged Edge: Finding Joy in a World Gone Mad: Workbook
9780385324137,A Door of Hope
9780770429454,Captivating: Unveiling the Mystery of a Woman's Soul
9780099911708,Family (Firstborn  #4)
9780345419088,Found (Firstborn  #3)
9780440506812,Forever (Firstborn  #5)
9780861711765,Ever After (Lost Love  #2)
9780805065374,Return (Redemption  #3)
9780312985349,The Red Gloves Collection (Red Gloves  #1-4)
,Reunion (Redemption  #5)
9780517618875,Redemption (Redemption  #1)
9780192839992,Forgiven (Firstborn  #2)
9780571217359,Rejoice (Redemption  #4)
9780141441146,Where I'm Calling From: New and Selected Stories
9780393975420,All of Us: The Collected Poems
9780679886181,Short Cuts: Selected Stories
9780452287983,Cathedral
9780140437287,In Pharaoh's Army: Memories of the Lost War
,Old School
9780156029582,This Boy's Life
9780156029810,The Vintage Book of Contemporary American Short Stories
9780156029049,We Wish to Inform You That Tomorrow We Will Be Killed with Our Families
9780156260268,The Paris Review Interviews  I: 16 Celebrated Interviews
9780156400572,The Living and the Dead: Robert McNamara and Five Lives of a Lost War
9780804001489,Sons of Mississippi: A Story of Race and Its Legacy
9780156260275,Looking for the Light: The Hidden Life and Art of Marion Post Wolcott
9780140139402,The Color Purple
9781586853334,Bright Purple: Color Me Confused (TrueColors  #10)
9780786715794,Humboldt's Gift
9780750244916,The Promise
,The Gift of Asher Lev
,In the Beginning
,My Name Is Asher Lev
9780767915304,1 000 Places to See Before You Die
9780143037392,The Crook Factory
9780375708213,Swan Song
9780380818952,Mine
9780712677165,Gone South
9780517539491,Usher's Passing
9780393099416,The Wolf's Hour
9780694524754,Mystery Walk
9780060765453,Boy's Life
9780060652920,Stinger
9780684823782,Swan Song
9780060652890,Danse Macabre
9780800783365,The Secretary of Dreams  Volume One
9780312263232,The Green Mile
9780842331913,Storm of the Century: An Original Screenplay
9780805210538,The Body
9780674854291,Creepshow
9780809037728,On Writing: A Memoir
9780805210194,The Shining
9780809023097,The Dark Half
9780805210286,The Science of Stephen King: From 'Carrie' to 'Cell ' The Terrifying Truth Behind the Horror Master's Fiction
9780936077499,The Girl Who Loved Tom Gordon
9780936077093,Riding the Bullet
9780505522740,The Bachman Books: Four Early Novels by Stephen King
9781578569502,Stand by Me
9780452280670,The Gardens of Emily Dickinson
9780452287075,The Life of Emily Dickinson
9780764586620,The Poems of Emily Dickinson
9780451137098,Selected Poetry of Emily Dickinson
9780451143426,The Unabridged Journals of Sylvia Plath
9780141186160,Ariel: The Restored Edition
9780140264920,The Colossus and Other Poems
9780141186177,Rough Magic: A Biography of Sylvia Plath
9780140024760,The Journals of Sylvia Plath
9780140031768,The Death and Life of Sylvia Plath
9780006496878,Te Kaihau: The Windeater
9780006496892,Everyman
9780006496908,American Pastoral (The American Trilogy  #1)
9780006496922,I Married a Communist (The American Trilogy  #2)
9780140020038,Sabbath's Theater
9780517170779,The Counterlife
9780751533934,Rabbit Angstrom: The Four Novels
9780751533118,Terrorist
9780553563504,Rabbit Novels: Rabbit  Run and Rabbit Redux
9780312980160,Brazil
9780446362665,Conversations with John Updike
,Rabbit at Rest (Rabbit Angstrom #4)
9780446359207,Rest Rabbit Rest (Sweet Pickles  #18)
9780553572988,The Mambo Kings Play Songs of Love
9780446364751,Mr. Ives' Christmas
9780451025012,A Simple Habana Melody
9780099455448,The Fourteen Sisters of Emilio Montez O'Brien
9780375704024,The Known World
9780375718946,The Stories of John Cheever
9780007175192,Istanbul: Memories and the City
9780020421900,The Black Book
9781416905271,The White Castle
9780689840333,Granta 85: Hidden Histories
9780394239101,The Collected Poems  1957-1987
9780394757643,The Labyrinth of Solitude and Other Writings
9780811215800,Sor Juana: Or  the Traps of Faith
9780307114631,Selected Poems
9780140014457,The Double Flame: Love and Eroticism
9781400078479,The English Patient: A Screenplay (Screen and Cinema)
9780307264886,Angels & Insects
9781400033423,The Blue Flower
9780452287068,The Bookshop  The Gate of Angels  The Blue Flower
9780292760288,The Human Stain (The American Trilogy  #3)
9780679411673,Housekeeping
9781400076215,All Aunt Hagar's Children: Stories
9780452283862,Lost in the City
9781400033430,White Noise
9780452263499,Americana
9780099760016,Love-Lies-Bleeding
,The Body Artist
9781400033447,The Hotel New Hampshire
9781566915908,The Hotel New Hampshire
9780345476098,Black Girl/White Girl
9780451216588,Them (Wonderland Quartet  #3)
9780486431673,You Must Remember This
9781593080365,Wonderland (Wonderland Quartet  #4)
9780375753145,Missing Mom
9781931082082,After the Wreck  I Picked Myself Up  Spread My Wings  and Flew Away
,Zombie
,Sabbath's Theater
9780766144736,The Stone Diaries
9780451526915,Insurgent Collective Action and Civil War in El Salvador
9780965020459,The Whipping Boy
9781418503468,Dicey's Song (Tillerman Cycle  #2)
9780898401875,Puzzle Pack: The Witch of Blackbird Pond
9780785264699,City on the Seine: Paris in the Time of Richelieu and Louis XIV  1614-1715
9780842387460,Teach Them Diligently: How to Use the Scriptures in Child Training
9780842387453,The Confessions of Nat Turner
9781414307640,Set This House On Fire
9780310247562,Darkness Visible: A Memoir of Madness
9780842382892,A Book of Blue Flowers
9780446579629,Falconer
9780842386883,The Wapshot Chronicle
9780842356220,72 Hour Hold
9780842387446,The Witching Hour (Lives of the Mayfair Witches  #1)
9780842386876,The Victim
